{
  "schema_version": "1.0.0",
  "event_id": "22222222-2222-4222-8222-222222222222",
  "timestamp": "2026-09-16T14:05:00.000Z",
  "exercise_id": "silent-spider",
  "run_id": "run-20260916-001",
  "sequence": 2,
  "event_type": "identity.session.created",
  "phase": "identity",
  "source": {
    "kind": "module",
    "component": "idp01",
    "host": "IDP01"
  },
  "actor": {
    "type": "synthetic_identity",
    "id": "sarah.mitchell",
    "display_name": "Sarah Mitchell"
  },
  "action": "session.create",
  "target": {
    "type": "session",
    "id": "sess-red-01"
  },
  "outcome": {
    "status": "success"
  },
  "severity": "high",
  "visibility": "participant",
  "safety": {
    "simulation_only": true,
    "dry_run": false,
    "within_allowlist": true,
    "destructive": false,
    "controls": ["synthetic-identities", "test-network-only"]
  },
  "provenance": {
    "producer": "idp01",
    "producer_version": "1.0.0",
    "integrity": {
      "algorithm": "sha256",
      "digest": "aaaaaaaaaaaaaaaaaaaaaaaaaaaaaaaaaaaaaaaaaaaaaaaaaaaaaaaaaaaaaaaa"
    }
  },
  "message": "Synthetic identity session created from the exercise threat source",
  "attack": {
    "technique_id": "T1078",
    "tactic": "defense-evasion"
  },
  "objective_ids": ["LO1", "LO2", "LO3"],
  "checkpoint_id": "DP2",
  "correlation_ids": ["11111111-1111-4111-8111-111111111111"],
  "raw_data_ref": null,
  "data": {
    "source_ip": "203.0.113.77",
    "session_id": "sess-red-01",
    "synthetic": true
  },
  "extensions": {}
}
